{
  "chrom": "LG28",
  "n_samples": 12,
  "windows": [
    { "idx": 0, "start_bp": 1000000, "end_bp": 1100000, "K": 1, "labels": [0,0,0,0,0,0,0,0,0,0,0,0], "pc1": [-0.1,-0.05,0.0,0.05,-0.05,0.0,0.05,-0.03,0.02,-0.04,0.01,0.03] },
    { "idx": 1, "start_bp": 1100000, "end_bp": 1200000, "K": 1, "labels": [0,0,0,0,0,0,0,0,0,0,0,0], "pc1": [-0.05,0.0,0.02,-0.02,0.04,-0.03,0.01,-0.04,0.03,-0.02,0.05,0.0] },

    { "idx": 2, "start_bp": 1200000, "end_bp": 1300000, "K": 3, "labels": [0,0,0,0,1,1,1,1,2,2,2,2], "pc1": [-0.62,-0.55,-0.48,-0.51,0.02,-0.04,0.05,0.01,0.58,0.51,0.62,0.55] },
    { "idx": 3, "start_bp": 1300000, "end_bp": 1400000, "K": 3, "labels": [0,0,0,0,1,1,1,1,2,2,2,2], "pc1": [-0.60,-0.53,-0.47,-0.50,0.01,-0.03,0.06,0.02,0.57,0.52,0.61,0.56] },
    { "idx": 4, "start_bp": 1400000, "end_bp": 1500000, "K": 3, "labels": [0,0,0,0,1,1,1,1,2,2,2,2], "pc1": [-0.61,-0.54,-0.48,-0.52,0.02,-0.05,0.05,0.01,0.59,0.51,0.63,0.55] },
    { "idx": 5, "start_bp": 1500000, "end_bp": 1600000, "K": 3, "labels": [0,0,0,0,1,1,1,1,2,2,2,2], "pc1": [-0.60,-0.55,-0.49,-0.50,0.03,-0.04,0.05,0.00,0.58,0.52,0.62,0.55] },
    { "idx": 6, "start_bp": 1600000, "end_bp": 1700000, "K": 3, "labels": [0,0,0,0,1,1,1,1,2,2,2,2], "pc1": [-0.61,-0.54,-0.48,-0.51,0.02,-0.04,0.06,0.01,0.58,0.51,0.62,0.55] },

    { "idx": 7, "start_bp": 1700000, "end_bp": 1800000, "K": 1, "labels": [0,0,0,0,0,0,0,0,0,0,0,0], "pc1": [0.0,0.0,0.0,0.0,0.0,0.0,0.0,0.0,0.0,0.0,0.0,0.0] },

    { "idx": 8, "start_bp": 1800000, "end_bp": 1900000, "K": 2, "labels": [0,0,0,0,0,0,1,1,1,1,1,1], "pc1": [-0.55,-0.52,-0.48,-0.51,-0.53,-0.50,0.55,0.51,0.58,0.52,0.61,0.54] },
    { "idx": 9, "start_bp": 1900000, "end_bp": 2000000, "K": 2, "labels": [0,0,0,0,0,0,1,1,1,1,1,1], "pc1": [-0.54,-0.51,-0.48,-0.50,-0.52,-0.49,0.55,0.52,0.59,0.53,0.62,0.55] },
    { "idx": 10, "start_bp": 2000000, "end_bp": 2100000, "K": 2, "labels": [0,0,0,0,0,0,1,1,1,1,1,1], "pc1": [-0.55,-0.50,-0.48,-0.51,-0.52,-0.49,0.54,0.51,0.59,0.52,0.61,0.55] },
    { "idx": 11, "start_bp": 2100000, "end_bp": 2200000, "K": 2, "labels": [0,0,0,0,0,0,1,1,1,1,1,1], "pc1": [-0.54,-0.51,-0.48,-0.50,-0.53,-0.50,0.55,0.52,0.59,0.53,0.62,0.55] },
    { "idx": 12, "start_bp": 2200000, "end_bp": 2300000, "K": 2, "labels": [0,0,0,0,0,0,1,1,1,1,1,1], "pc1": [-0.55,-0.50,-0.47,-0.51,-0.52,-0.49,0.55,0.51,0.59,0.52,0.61,0.54] }
  ],
  "seed_windows": [4, 10],
  "params": {
    "branches": ["het", "hom_separation"],
    "min_chain_length": 3,
    "cramers_v_threshold": 0.70
  },
  "input_layer_ids": ["scrubber_main:LG28"]
}
